{"compact_t03_only":true,"config_binding":{"bom":false,"canonical_json_sha256":"f3049bab35f6ea275254c737bc810ee8f2903c28de9f1e78db55007cbd284221","committed_byte_sha256":"8ac87d733919ce32d8906396655ea2388cfe515806c07e8fc5af3c7d54d29e8b","encoding":"utf-8","git_blob_sha":"bab168ca12a706f750bd5dcef9931e21d1270331","line_ending":"lf","normalized_text_sha256":"8ac87d733919ce32d8906396655ea2388cfe515806c07e8fc5af3c7d54d29e8b","path":"configs/r2/r2_t04_hard_gate_pareto_freeze_plan.v1.json","source_commit":"3d31a8cd8a314ad15d3bccd5d09a003076e6d131","terminal_lf_count":1},"execution_commit":"3d31a8cd8a314ad15d3bccd5d09a003076e6d131","hash_authority":"committed_git_blob_only","local_duckdb_used":false,"phase":"A","source_bindings":[{"bom":false,"committed_byte_sha256":"aefc70132acf2dd3d033f17d415a6a768b2a9fa937a110490e7943a0dbaa7ada","encoding":"utf-8","git_blob_sha":"9a970213af199cc8f916515080ebd5a1bb06c566","line_ending":"lf","normalized_text_sha256":"aefc70132acf2dd3d033f17d415a6a768b2a9fa937a110490e7943a0dbaa7ada","path":"data/generated/r2/r2_t03/R2-T03-PROMOTED-20260713T050903Z/r2_t03_cell_execution_registry.csv","role":"t03_compact","source_commit":"3d31a8cd8a314ad15d3bccd5d09a003076e6d131","terminal_lf_count":1},{"bom":false,"committed_byte_sha256":"f48cab543258443ea33c5d4ffaaee37ae118aa0544f39649b2735adb31ac2b53","encoding":"utf-8","git_blob_sha":"b64dae71854ebc997f0f0818fc46b265efa5e562","line_ending":"lf","normalized_text_sha256":"f48cab543258443ea33c5d4ffaaee37ae118aa0544f39649b2735adb31ac2b53","path":"data/generated/r2/r2_t03/R2-T03-PROMOTED-20260713T050903Z/r2_t03_metric_results.csv","role":"t03_compact","source_commit":"3d31a8cd8a314ad15d3bccd5d09a003076e6d131","terminal_lf_count":1},{"bom":false,"committed_byte_sha256":"8562f53fc798e4463a79cdf7a87ef9d66cba6281e302ae85b625b3ad7fd73dda","encoding":"utf-8","git_blob_sha":"e8f7fe5ee40c8f67e6853859e2bd61b718547eea","line_ending":"lf","normalized_text_sha256":"8562f53fc798e4463a79cdf7a87ef9d66cba6281e302ae85b625b3ad7fd73dda","path":"data/generated/r2/r2_t03/R2-T03-PROMOTED-20260713T050903Z/r2_t03_dg_event_zone_profile.csv","role":"t03_compact","source_commit":"3d31a8cd8a314ad15d3bccd5d09a003076e6d131","terminal_lf_count":1},{"bom":false,"committed_byte_sha256":"78d4a68a90a85b015d57f9e1cd24ddcb436fdce91ed4c56cc683fab6cad106f0","encoding":"utf-8","git_blob_sha":"2b46d29b3a983f9f54a1c4b149bc55dc1ca2f72c","line_ending":"lf","normalized_text_sha256":"78d4a68a90a85b015d57f9e1cd24ddcb436fdce91ed4c56cc683fab6cad106f0","path":"data/generated/r2/r2_t03/R2-T03-PROMOTED-20260713T050903Z/r2_t03_atomic_baseline_profile.csv","role":"t03_compact","source_commit":"3d31a8cd8a314ad15d3bccd5d09a003076e6d131","terminal_lf_count":1},{"bom":false,"committed_byte_sha256":"7c389dde8516cadb80d2f791868e5781f3bfbd359d419c842c494f8197e4e905","encoding":"utf-8","git_blob_sha":"a9c76eedc6d6645cf6ecf5cea72c427b158ce76c","line_ending":"lf","normalized_text_sha256":"7c389dde8516cadb80d2f791868e5781f3bfbd359d419c842c494f8197e4e905","path":"data/generated/r2/r2_t03/R2-T03-PROMOTED-20260713T050903Z/r2_t03_atomic_interval_diagnostic_profile.csv","role":"t03_compact","source_commit":"3d31a8cd8a314ad15d3bccd5d09a003076e6d131","terminal_lf_count":1},{"bom":false,"committed_byte_sha256":"6d7a30a0542fbd0435cb9d6283e6aee5a4e658d70c0a6b5b07bdef5bec4dae07","encoding":"utf-8","git_blob_sha":"46d9748f3dc58af279d19625ad5071e7fa18c91c","line_ending":"lf","normalized_text_sha256":"6d7a30a0542fbd0435cb9d6283e6aee5a4e658d70c0a6b5b07bdef5bec4dae07","path":"data/generated/r2/r2_t03/R2-T03-PROMOTED-20260713T050903Z/r2_t03_component_diagnostic_profile.csv","role":"t03_compact","source_commit":"3d31a8cd8a314ad15d3bccd5d09a003076e6d131","terminal_lf_count":1},{"bom":false,"committed_byte_sha256":"1ac1a57446e3c971f2f5554c1f2456d04d64d7803730fd211d5903a023ca443c","encoding":"utf-8","git_blob_sha":"3c91bf5c476d0a65923d2169403fd221c9c6f66f","line_ending":"lf","normalized_text_sha256":"1ac1a57446e3c971f2f5554c1f2456d04d64d7803730fd211d5903a023ca443c","path":"data/generated/r2/r2_t03/R2-T03-PROMOTED-20260713T050903Z/r2_t03_event_zone_diagnostic_profile.csv","role":"t03_compact","source_commit":"3d31a8cd8a314ad15d3bccd5d09a003076e6d131","terminal_lf_count":1},{"bom":false,"committed_byte_sha256":"18847b6a0d19affebd6953309f189d30896e408ba7bb8c9e07b8eb909c247dc4","encoding":"utf-8","git_blob_sha":"0187f0d491b5a047497111763d0bb652615a9cd7","line_ending":"lf","normalized_text_sha256":"18847b6a0d19affebd6953309f189d30896e408ba7bb8c9e07b8eb909c247dc4","path":"data/generated/r2/r2_t03/R2-T03-PROMOTED-20260713T050903Z/r2_t03_parameter_invariant_profile.csv","role":"t03_diagnostics","source_commit":"3d31a8cd8a314ad15d3bccd5d09a003076e6d131","terminal_lf_count":1},{"bom":false,"committed_byte_sha256":"f03fb009ca32628502014ecff9afdffeefd101f1890f5e73014b7d7ca18f9beb","encoding":"utf-8","git_blob_sha":"27a35043fbf8cfa6536eddef99d30df84873a6b4","line_ending":"lf","normalized_text_sha256":"f03fb009ca32628502014ecff9afdffeefd101f1890f5e73014b7d7ca18f9beb","path":"data/generated/r2/r2_t03/R2-T03-PROMOTED-20260713T050903Z/r2_t03_window_diagnostic_profile.csv","role":"t03_diagnostics","source_commit":"3d31a8cd8a314ad15d3bccd5d09a003076e6d131","terminal_lf_count":1},{"bom":false,"committed_byte_sha256":"48baf3c99b1291ad0e2db0b4dff280a67d628abc1c4761cd8a6d642d5cca4537","encoding":"utf-8","git_blob_sha":"dcf3a05e96b3d8b8054a4fe25e407b293a2e10d9","line_ending":"lf","normalized_text_sha256":"48baf3c99b1291ad0e2db0b4dff280a67d628abc1c4761cd8a6d642d5cca4537","path":"data/generated/r2/r2_t03/R2-T03-PROMOTED-20260713T050903Z/r2_t03_strict_core_diagnostic_profile.csv","role":"t03_diagnostics","source_commit":"3d31a8cd8a314ad15d3bccd5d09a003076e6d131","terminal_lf_count":1},{"bom":false,"committed_byte_sha256":"06e3d16a9f6e2b315b2ba3461282e9ae7024d7632f5a3e47d70bf7397ff698bb","encoding":"utf-8","git_blob_sha":"36dbf2326c5935223ef7c88f6d33b5fe839560bf","line_ending":"lf","normalized_text_sha256":"06e3d16a9f6e2b315b2ba3461282e9ae7024d7632f5a3e47d70bf7397ff698bb","path":"data/generated/r2/r2_t03/R2-T03-PROMOTED-20260713T050903Z/r2_t03_strict_core_shell_profile.csv","role":"t03_diagnostics","source_commit":"3d31a8cd8a314ad15d3bccd5d09a003076e6d131","terminal_lf_count":1},{"bom":false,"canonical_json_sha256":"a41598316701a585401dbbf6135cba2dfc44a6f8559e02e9d5fe276d4f640e60","committed_byte_sha256":"8e53045b8ec712890b78feb4674e34be6dd53d57b4dc2f178d0053a0fe07547e","encoding":"utf-8","git_blob_sha":"f8a7b4ade053cc3f50be60d67a41763b5e77d0ed","line_ending":"lf","normalized_text_sha256":"8e53045b8ec712890b78feb4674e34be6dd53d57b4dc2f178d0053a0fe07547e","path":"data/generated/r2/r2_t03/R2-T03-PROMOTED-20260713T050903Z/r2_t03_anomaly_scan.json","role":"t03_validation","source_commit":"3d31a8cd8a314ad15d3bccd5d09a003076e6d131","terminal_lf_count":1},{"bom":false,"committed_byte_sha256":"3ae1800b45fb7dede20c379e508cf052d438748e82b86bd49611304cb3dc3de0","encoding":"utf-8","git_blob_sha":"d7cedcda482eac70936e0feafabde7461e65e629","line_ending":"lf","normalized_text_sha256":"3ae1800b45fb7dede20c379e508cf052d438748e82b86bd49611304cb3dc3de0","path":"data/generated/r2/r2_t03/R2-T03-PROMOTED-20260713T050903Z/r2_t03_runtime_gate_results.csv","role":"t03_validation","source_commit":"3d31a8cd8a314ad15d3bccd5d09a003076e6d131","terminal_lf_count":1},{"bom":false,"canonical_json_sha256":"dc3bb28de75ca1ecf69fc6a37b2dc1f24368945bade9292b66996f3a37191005","committed_byte_sha256":"a0feff3ef844f3ecf3366cdf95657433c53f462978bf7f78cb5cf4b20c9d483e","encoding":"utf-8","git_blob_sha":"f6678839f0f56b661e2035a2d0233be81a0e464e","line_ending":"lf","normalized_text_sha256":"a0feff3ef844f3ecf3366cdf95657433c53f462978bf7f78cb5cf4b20c9d483e","path":"data/generated/r2/r2_t03/R2-T03-PROMOTED-20260713T050903Z/r2_t03_independent_validation.json","role":"t03_validation","source_commit":"3d31a8cd8a314ad15d3bccd5d09a003076e6d131","terminal_lf_count":1},{"bom":false,"canonical_json_sha256":"0c5fc7eb8ed8d8ac680cfd43393be69948c30c7f3c3743ef39b9636677e3cf03","committed_byte_sha256":"46e0a8e06db3d17b395cdfeb900e364853b93645c602b09f04bd0e9dfb98afd6","encoding":"utf-8","git_blob_sha":"e765911c8a40159d72a159795464256313afe173","line_ending":"lf","normalized_text_sha256":"46e0a8e06db3d17b395cdfeb900e364853b93645c602b09f04bd0e9dfb98afd6","path":"data/generated/r2/r2_t03/R2-T03-PROMOTED-20260713T050903Z/r2_t03_result_package.json","role":"t03_validation","source_commit":"3d31a8cd8a314ad15d3bccd5d09a003076e6d131","terminal_lf_count":1},{"bom":false,"canonical_json_sha256":"0454a72a943835b82a08e51a6d378be78bb5a4a5347e144d4df41b62c91c197b","committed_byte_sha256":"90c28efd9fa232f2fcdd05edb258aa7d91f829f1a16dfc5671dfa7057252aa48","encoding":"utf-8","git_blob_sha":"40a69a34ebe25a66750f8fa2032cadcedaa919c7","line_ending":"lf","normalized_text_sha256":"90c28efd9fa232f2fcdd05edb258aa7d91f829f1a16dfc5671dfa7057252aa48","path":"data/generated/r2/r2_t03/R2-T03-PROMOTED-20260713T050903Z/r2_t03_repository_final_gate_handoff_validation.json","role":"t03_handoff","source_commit":"3d31a8cd8a314ad15d3bccd5d09a003076e6d131","terminal_lf_count":1},{"bom":false,"canonical_json_sha256":"95c13670c972252b346895b77fa442d53a927b5bd3c119f88f63ca9494ff73c5","committed_byte_sha256":"5311a6d379483eaee19f73885c8b8bcd552196ac57137c0a890b5753e5f530cb","encoding":"utf-8","git_blob_sha":"e86ce4ccbd58d5adf3fd6b12095912c21b58b02b","line_ending":"lf","normalized_text_sha256":"5311a6d379483eaee19f73885c8b8bcd552196ac57137c0a890b5753e5f530cb","path":"data/generated/r2/r2_t03/R2-T03-PROMOTED-20260713T050903Z/r2_t03_author_stage_scientific_review.json","role":"t03_author_package","source_commit":"3d31a8cd8a314ad15d3bccd5d09a003076e6d131","terminal_lf_count":1},{"bom":false,"committed_byte_sha256":"533978218585c510693d4236261b23d7a42834786a699412200e9d5f0d2012f5","encoding":"utf-8","git_blob_sha":"27d9b30c04b1d808cc4d245832b9d04dbf5f43fc","line_ending":"lf","normalized_text_sha256":"533978218585c510693d4236261b23d7a42834786a699412200e9d5f0d2012f5","path